{
  "schema_version": 1,
  "generated_at": "2026-10-22T06:47:45+00:00",
  "built_at": "2026-10-22T06:47:46+00:00",
  "brands": [
    {
      "brand_id": "geely",
      "name_en": "Geely",
      "name_zh": "吉利",
      "aliases": [
        "吉利",
        "Джили"
      ],
      "active": true,
      "parent_brand_id": null
    },
    {
      "brand_id": "haval",
      "name_en": "HAVAL",
      "name_zh": "哈弗",
      "aliases": [
        "哈弗",
        "Хавейл"
      ],
      "active": true,
      "parent_brand_id": null
    },
    {
      "brand_id": "tenet",
      "name_en": "TENET",
      "name_zh": "TENET",
      "aliases": [
        "Тенет"
      ],
      "active": true,
      "parent_brand_id": null
    },
    {
      "brand_id": "changan",
      "name_en": "Changan",
      "name_zh": "长安",
      "aliases": [
        "长安",
        "Чанган"
      ],
      "active": true,
      "parent_brand_id": null
    },
    {
      "brand_id": "hongqi",
      "name_en": "Hongqi",
      "name_zh": "红旗",
      "aliases": [
        "红旗",
        "Хончи"
      ],
      "active": true,
      "parent_brand_id": null
    }
  ],
  "models": [
    {
      "model_id": "geely-monjaro",
      "brand_id": "geely",
      "name": "Monjaro",
      "aliases": [
        "蒙扎罗",
        "星越L",
        "Монджаро"
      ],
      "body_type": "suv",
      "active": true,
      "year": null,
      "catalog_status": "official_catalog",
      "catalog_source": "https://www.geely-motors.com/model/monjaro/",
      "status": "needs_review",
      "promo": {
        "min_rub": null,
        "max_rub": null,
        "coverage": "observed_trims_only",
        "min_offer": null,
        "max_offer": null
      },
      "msrp": {
        "min_rub": null,
        "max_rub": null,
        "coverage": "observed_trims_only",
        "min_offer": null,
        "max_offer": null
      },
      "offers": []
    },
    {
      "model_id": "geely-coolray",
      "brand_id": "geely",
      "name": "Coolray",
      "aliases": [
        "缤越",
        "Кулрей"
      ],
      "body_type": "suv",
      "active": true,
      "year": null,
      "catalog_status": "official_catalog",
      "catalog_source": "https://www.geely-motors.com/model/monjaro/",
      "status": "needs_review",
      "promo": {
        "min_rub": null,
        "max_rub": null,
        "coverage": "observed_trims_only",
        "min_offer": null,
        "max_offer": null
      },
      "msrp": {
        "min_rub": null,
        "max_rub": null,
        "coverage": "observed_trims_only",
        "min_offer": null,
        "max_offer": null
      },
      "offers": []
    },
    {
      "model_id": "geely-cityray",
      "brand_id": "geely",
      "name": "Cityray",
      "aliases": [
        "博越COOL",
        "Ситирей"
      ],
      "body_type": "suv",
      "active": true,
      "year": null,
      "catalog_status": "official_catalog",
      "catalog_source": "https://www.geely-motors.com/model/monjaro/",
      "status": "needs_review",
      "promo": {
        "min_rub": null,
        "max_rub": null,
        "coverage": "observed_trims_only",
        "min_offer": null,
        "max_offer": null
      },
      "msrp": {
        "min_rub": null,
        "max_rub": null,
        "coverage": "observed_trims_only",
        "min_offer": null,
        "max_offer": null
      },
      "offers": []
    },
    {
      "model_id": "geely-atlas",
      "brand_id": "geely",
      "name": "Atlas",
      "aliases": [
        "博越L",
        "Атлас"
      ],
      "body_type": "suv",
      "active": true,
      "year": null,
      "catalog_status": "official_catalog",
      "catalog_source": "https://www.geely-motors.com/model/monjaro/",
      "status": "needs_review",
      "promo": {
        "min_rub": null,
        "max_rub": null,
        "coverage": "observed_trims_only",
        "min_offer": null,
        "max_offer": null
      },
      "msrp": {
        "min_rub": null,
        "max_rub": null,
        "coverage": "observed_trims_only",
        "min_offer": null,
        "max_offer": null
      },
      "offers": []
    },
    {
      "model_id": "geely-okavango",
      "brand_id": "geely",
      "name": "Okavango",
      "aliases": [
        "豪越L",
        "Окаванго"
      ],
      "body_type": "suv",
      "active": true,
      "year": null,
      "catalog_status": "official_catalog",
      "catalog_source": "https://www.geely-motors.com/model/monjaro/",
      "status": "needs_review",
      "promo": {
        "min_rub": null,
        "max_rub": null,
        "coverage": "observed_trims_only",
        "min_offer": null,
        "max_offer": null
      },
      "msrp": {
        "min_rub": null,
        "max_rub": null,
        "coverage": "observed_trims_only",
        "min_offer": null,
        "max_offer": null
      },
      "offers": []
    },
    {
      "model_id": "geely-preface",
      "brand_id": "geely",
      "name": "Preface",
      "aliases": [
        "星瑞",
        "Префейс"
      ],
      "body_type": "sedan",
      "active": true,
      "year": null,
      "catalog_status": "official_catalog",
      "catalog_source": "https://www.geely-motors.com/model/monjaro/",
      "status": "needs_review",
      "promo": {
        "min_rub": null,
        "max_rub": null,
        "coverage": "observed_trims_only",
        "min_offer": null,
        "max_offer": null
      },
      "msrp": {
        "min_rub": null,
        "max_rub": null,
        "coverage": "observed_trims_only",
        "min_offer": null,
        "max_offer": null
      },
      "offers": []
    },
    {
      "model_id": "geely-ex5",
      "brand_id": "geely",
      "name": "EX5",
      "aliases": [
        "银河E5"
      ],
      "body_type": "suv",
      "active": true,
      "year": null,
      "catalog_status": "official_catalog",
      "catalog_source": "https://www.geely-motors.com/model/monjaro/",
      "status": "needs_review",
      "promo": {
        "min_rub": null,
        "max_rub": null,
        "coverage": "observed_trims_only",
        "min_offer": null,
        "max_offer": null
      },
      "msrp": {
        "min_rub": null,
        "max_rub": null,
        "coverage": "observed_trims_only",
        "min_offer": null,
        "max_offer": null
      },
      "offers": []
    },
    {
      "model_id": "geely-ex5-hybrid",
      "brand_id": "geely",
      "name": "EX5 Hybrid",
      "aliases": [
        "EX5 EM-i",
        "银河星舰7"
      ],
      "body_type": "suv",
      "active": true,
      "year": null,
      "catalog_status": "official_catalog",
      "catalog_source": "https://www.geely-motors.com/model/monjaro/",
      "status": "needs_review",
      "promo": {
        "min_rub": null,
        "max_rub": null,
        "coverage": "observed_trims_only",
        "min_offer": null,
        "max_offer": null
      },
      "msrp": {
        "min_rub": null,
        "max_rub": null,
        "coverage": "observed_trims_only",
        "min_offer": null,
        "max_offer": null
      },
      "offers": []
    },
    {
      "model_id": "haval-jolion",
      "brand_id": "haval",
      "name": "Jolion",
      "aliases": [
        "初恋",
        "Джолион"
      ],
      "body_type": "suv",
      "active": true,
      "year": null,
      "catalog_status": "official_catalog",
      "catalog_source": "https://haval.ru/purchase/catalogues/",
      "status": "needs_review",
      "promo": {
        "min_rub": null,
        "max_rub": null,
        "coverage": "observed_trims_only",
        "min_offer": null,
        "max_offer": null
      },
      "msrp": {
        "min_rub": null,
        "max_rub": null,
        "coverage": "observed_trims_only",
        "min_offer": null,
        "max_offer": null
      },
      "offers": []
    },
    {
      "model_id": "haval-m6",
      "brand_id": "haval",
      "name": "M6",
      "aliases": [
        "哈弗M6"
      ],
      "body_type": "suv",
      "active": true,
      "year": null,
      "catalog_status": "official_catalog",
      "catalog_source": "https://haval.ru/purchase/catalogues/",
      "status": "needs_review",
      "promo": {
        "min_rub": null,
        "max_rub": null,
        "coverage": "observed_trims_only",
        "min_offer": null,
        "max_offer": null
      },
      "msrp": {
        "min_rub": null,
        "max_rub": null,
        "coverage": "observed_trims_only",
        "min_offer": null,
        "max_offer": null
      },
      "offers": []
    },
    {
      "model_id": "haval-dargo",
      "brand_id": "haval",
      "name": "Dargo",
      "aliases": [
        "大狗",
        "Дарго"
      ],
      "body_type": "suv",
      "active": true,
      "year": null,
      "catalog_status": "official_catalog",
      "catalog_source": "https://haval.ru/purchase/catalogues/",
      "status": "needs_review",
      "promo": {
        "min_rub": null,
        "max_rub": null,
        "coverage": "observed_trims_only",
        "min_offer": null,
        "max_offer": null
      },
      "msrp": {
        "min_rub": null,
        "max_rub": null,
        "coverage": "observed_trims_only",
        "min_offer": null,
        "max_offer": null
      },
      "offers": []
    },
    {
      "model_id": "haval-dargo-x",
      "brand_id": "haval",
      "name": "Dargo X",
      "aliases": [
        "大狗X",
        "Дарго X"
      ],
      "body_type": "suv",
      "active": true,
      "year": null,
      "catalog_status": "official_catalog",
      "catalog_source": "https://haval.ru/purchase/catalogues/",
      "status": "needs_review",
      "promo": {
        "min_rub": null,
        "max_rub": null,
        "coverage": "observed_trims_only",
        "min_offer": null,
        "max_offer": null
      },
      "msrp": {
        "min_rub": null,
        "max_rub": null,
        "coverage": "observed_trims_only",
        "min_offer": null,
        "max_offer": null
      },
      "offers": []
    },
    {
      "model_id": "haval-f7",
      "brand_id": "haval",